topic_name,topic_id,words
E,2,"эколог, экологическии, экологичныи, экологически, экологичность, природоохранныи, экология, загрязнение, биотопливо, экосистема, отход, экологиче, утилизироваться, загрязнить, водохранилище, газификация, экопросвещение, утилизация, нефтезагрязнить, утилизировать, атмосфера, атмосферныи, уничтожение, захоронение, выброс, загрязнять, эко, ископаемое, поселение, водопотребление, заповедник, мусор, гидрологическии, канализация, рекуперация, месторождение, разрушение, биотехнология, выведение, загрязнитель, водозабор, инстанция, водоснабжение, озеленение, эвакуация, водоочистныи, водоохранныи, окружение, водозаборныи, озоноразрушать"
Вода,11,"водоочистныи, водозаборныи, водопотребление, водозабор, водопроводныи, водоснабжение, водоканал, канализация, водоотведение, водопользование, водохранилище, водопровод, водоток, водовод, водоохранныи, водоем, водоочистка, акватория, наводнение, вода, водоподготовка, водственныи, дренажныи, гидрогенерация, речнои, водныи, гидрологическии, водородныи, утилизировать, река, утилизироваться, рекуперация, коммунальныи, ресурсныи, закупаться, водство, загрязнение, осадки, озеро, утилизация, океан, приток, гидро, осадка, гидроагрегат, скважина, рекреационныи, гидроразрыв, отход, вводныи"
Энергия,12,"энергозатраты, энергоресурсы, энергосбытовыи, энергоемкии, энергоснабжение, энергосбыт, энергообъект, энерго, энергоустановка, энергия, энергоатом, энергоемкость, энергетика, энергоноситель, энергохолдинг, энергопринимать, росэнергоатом, энергетическии, энергоаудит, энергокомплекс, электроэнергия, теплоэнергетика, энергокомпания, теплоэнергия, энергосервисныи, ленэнерго, энергобаланс, энергетик, электростанция, энергосистема, бурятэнерго, энергосервис, атомэнергопром, минэнерго, новгородэнерго, тываэнерго, атомэнергомаш, отопление, комиэнерго, энерджи, мосэнергосбыт, янтарьэнерго, магаданэнерго, топливо, алтаиэнерго, энергоблок, топливныи, ветроэнергетика, мосэнерго, теплов"
E,14,"эколог, природоохранныи, экологичныи, газа, газификация, нефть, экологическии, биотопливо, газоснабжение, газпромнефть, атомэнергопром, нефтегаз, резервист, обязательство, таманьнефтегаз, газпром, требование, газ, экопросвещение, экологичность, месторождение, единство, глобальныи, роснефть, топливо, зования, экологически, ископаемое, экономист, инстанция, газовыи, эко, девальвация, уникальность, глобализация, сургутнефтегаз, инициативность, нефтегазовыи, население, премия, инвестиция, секретариат, фабрикация, климат, топливныи, ведомость, работник, факторинг, ценность, нефтебаза"
Экологический менеджмент,15,"природоохранныи, эколог, охрана, безопасность, экологическии, охранныи, экологичныи, экологически, политик, промышленность, секретариат, безопасныи, охранять, экологичность, секретарь, экология, сохранность, пасность, безопасно, фабрикация, производствен, сохранение, защищенность, заповедник, политика, увольнение, защита, защитить, промышленныи, опасение, месторождение, обстановка, сохраняться, обеспеченность, отрасль, экосистема, промышленник, геолог, уволиться, уволить, защищать, нефть, гарантииныи, менеджмент, цех, природа, агрохимическии, сохранять, окружение, защитныи"
Газ,18,"газпром, газоснабжение, газпромнефть, газа, газовыи, газ, газопереработка, газификация, газообразныи, газотурбинныи, газоочистныи, севергазпром, газпромбанк, газопровод, сургутнефтегаз, газодобывающии, газохимическии, эколог, нефтегаз, таманьнефтегаз, биотопливо, вниигаз, парогазовыи, атомэнергопром, газомоторныи, экологичныи, атмосфера, топливныи, атмосферныи, топливо, дегазация, газоочистка, климат, экологическии, климатическии, согаз, бензин, бензиновыи, глобальныи, экологичность, ископаемое, экологически, природоохранныи, экопросвещение, авиатопливо, пром, эко, нефть, нефтегазовыи, экологиче"
Энергия,20,"федерация, атомэнергопром, участие, облигация, энергия, энергоатом, открытость, теплоэнергия, атомныи, энергосбыт, энергообъект, элемент, атом, единство, энергетика, энерго, разделение, энергосбытовыи, котельная, реакция, территория, теплоэнергетика, эмоция, облигационныи, теплообменныи, участвовать, атомфлот, связанность, обязательность, присоединение, преемственность, факторинг, ценность, содружество, объективность, провинция, еврооблигация, поучаствовать, энергозатраты, энергоаудит, бурятэнерго, власть, энергоемкии, возгорание, коалиция, делить, энергоноситель, коррупция, энергокомплекс, себестоимость"
Газ,22,"газпромнефть, нефть, нефтегаз, таманьнефтегаз, роснефть, сургутнефтегаз, нефтебаза, нефтегазовыи, газпром, нефтянои, нефтеотдача, нефтепровод, газа, газоснабжение, севергазпром, газ, газпромбанк, нефтедобыча, нефтепродукт, нефтяник, нефтегазодобыча, газовыи, газообразныи, лифт, фт, нефтедобывающии, нефтехим, газопереработка, парогазовыи, биотопливо, газотурбинныи, газопровод, бензиновыи, бензин, топливо, нефтешламовыи, топливныи, скважина, газификация, добыча, газоочистныи, добычныи, географическии, нефтехимическии, география, пролив, вниигаз, нефтешлам, залив, нафт"
Энергия,25,"электростанция, инстанция, энергосбытовыи, энергосбыт, энергозатраты, электросетевои, энергообъект, энерго, энергоустановка, электрификация, власть, провинция, энергоаудит, энергоресурсы, электричество, электроэнергия, энергия, новгородэнерго, реконструкция, энергоатом, энергокомплекс, инфраструктура, реформа, переселение, реформирование, единство, энергоемкии, уникальность, энергоноситель, энергохолдинг, факторинг, энергопринимать, станция, энергосервисныи, энергокомпания, энергоснабжение, атомэнергомаш, катастрофа, федерация, разрушение, преемственность, электротехника, атомэнергопром, энергетика, неисправность, обременение, электросвязь, субъект, поселение, объект"
E,33,"эколог, экологическии, экологически, экологичныи, экология, природоохранныи, экологичность, биотопливо, экопросвещение, экологиче, газпромнефть, экосистема, озоноразрушать, газификация, геолог, газпром, геология, биомасса, биосферныи, биоресурсы, газоснабжение, эко, биотехнология, севергазпром, геологоразведка, газа, озеленение, нефть, заповедник, гидрологическии, атмосфера, роснефть, органическии, газовыи, биоразнообразие, растительность, оповещение, таманьнефтегаз, газ, среда, газпромбанк, сургутнефтегаз, зеленыи, месторождение, окружающии, атмосферныи, окружение, обстановка, газопровод, атомэнергопром"
E,46,"эколог, экологическии, водопотребление, экологичность, экологически, биотопливо, ресурсныи, природоохранныи, водоснабжение, экологичныи, экосистема, водохранилище, экопросвещение, газификация, водозабор, экология, водопроводныи, энергозатраты, водозаборныи, эко, водоохранныи, расход, водоотведение, население, отход, ресурс, рекуперация, экономика, топливныи, топливо, нефть, энергоресурсы, численность, значение, территория, энергообъект, водоканал, биоразнообразие, география, экологиче, географическии, атмосферныи, биографическии, газоснабжение, площадь, инстанция, водоочистныи, биоресурсы, девальвация, биомасса"
E,62,"эколог, экологическии, экологически, экологичныи, экологичность, экопросвещение, экология, выращивание, экосистема, озеленение, природоохранныи, волонтерство, экологиче, эко, зеленыи, поучаствовать, добровольческии, субботник, добровольчество, среда, растительность, заповедник, урожаиность, очистить, пивоварение, удобрение, органическии, акция, участвовать, биоресурсы, население, продвигать, озоноразрушать, участие, добровольныи, отход, поощрение, община, способствовать, биотопливо, поселение, водоснабжение, инстанция, вырастить, волонтер, водопотребление, сообщество, продвинуть, продвижение, поселок"
Энергия,69,"энергосбытовыи, энерго, энергоемкии, энергозатраты, энергоустановка, энергосбыт, электростанция, атомэнергомаш, энергоатом, электроэнергия, энергоноситель, энергоресурсы, энергообъект, энергоблок, энергоаудит, энергоемкость, энергоснабжение, росэнергоатом, энергия, энергопринимать, энергокомплекс, бурятэнерго, энергобаланс, атомэнергопром, ленэнерго, энергетика, атомпроект, минэнерго, энергохолдинг, энергосистема, мощность, энергетическии, псковэнерго, электричество, энергокомпания, новгородэнерго, тываэнерго, энерджи, магаданэнерго, мосэнергосбыт, энергосервисныи, власть, мосэнерго, алтаиэнерго, комиэнерго, энер, омскэнерго, энергосервис, энергетик, электро"
E,84,"экологическии, экологически, эколог, экономика, экопросвещение, ценность, экономически, экономическии, конкурентность, экологичность, толерантность, объективность, себестоимость, эмоция, экономист, честность, аспект, правомерность, промышленность, факторинг, отношение, взаимоуважение, справедливость, эко, эмоциональныи, отрицательныи, экология, связанность, квалификация, экологичныи, достоинство, экосистема, тивность, единство, субъект, преемственность, экономичность, политик, равенство, социологическии, работник, увольнение, сторона, маркетинговыи, теплоэнергетика, климатическии, классификация, взаимодеиствие, экономия, энергетика"
Энергия,85,"энергосбытовыи, энергообъект, энергозатраты, энергосбыт, энергохолдинг, электроэнергия, энерго, энергокомплекс, энергоснабжение, энергоемкии, энергоустановка, энергоресурсы, энергопринимать, энергия, энергоаудит, электростанция, энергоатом, энергетика, энергоемкость, энергоноситель, власть, ленэнерго, энергетическии, росэнергоатом, энергосервисныи, минэнерго, электричество, энергобаланс, экспорт, энергосервис, энерджи, комиэнерго, магаданэнерго, энергокомпания, энергоблок, экспортер, энергосистема, новгородэнерго, энергетик, электрификация, экспортировать, мосэнергосбыт, экспортныи, алтаиэнерго, тываэнерго, мощность, теплоэнергия, ветроэнергетика, электро, псковэнерго"
Энергия,86,"энергозатраты, ресурсныи, себестоимость, ресурс, льгота, субсидирование, энергия, экономическии, энерго, экономически, энергоресурсы, льготныи, энергетика, экономика, энергосбыт, теплоэнергетика, субсидия, энергосбытовыи, энергоснабжение, затрата, энергоатом, выгода, бенефициар, энергетическии, энергообъект, теплоэнергия, доходность, энергокомплекс, расход, местность, областнои, площадь, рентабельность, инфляция, источник, участие, муниципалитет, нефть, территория, энергоемкии, затратныи, регион, простота, капитал, энергопринимать, энергоноситель, процент, новгородэнерго, возгорание, отопление"
Энергия,87,"энергозатраты, энергоресурсы, эколог, экопросвещение, водопотребление, энергообъект, энергосбытовыи, экономия, энергоемкии, энергоснабжение, энерго, эко, экологичныи, энергохолдинг, энергосбыт, энергоатом, экологичность, экономист, экономика, энергия, энергетика, энергопринимать, утилизироваться, энергетическии, энергоноситель, энергокомпания, утилизировать, расход, экономить, энергоаудит, энергоустановка, экологическии, утилизация, росэнергоатом, энергосервисныи, экологиче, потребление, экологически, экономбанк, энергоемкость, сбережение, электростанция, экономичность, коммунальныи, водохранилище, энергобаланс, экономическии, роспотребнадзор, экономичныи, энергокомплекс"
Вода,88,"водопроводныи, водоканал, водозаборныи, водозабор, водоснабжение, водопровод, водоочистныи, водопотребление, водоотведение, канализация, водоток, водовод, водоем, водоочистка, водоохранныи, водохранилище, коммунальныи, наводнение, акватория, водоподготовка, водопользование, муниципальныи, водственныи, муниципалитет, речнои, вода, гидрологическии, поселок, рекуперация, водство, океан, закупаться, поселение, объединение, водныи, пул, дренажныи, река, новгородэнерго, рыболовство, сооружение, гидроразрыв, дождевои, вводныи, расход, гидро, гидрогенерация, рекреационныи, единство, пруд"
E,90,"эколог, экологичныи, экопросвещение, экологичность, экологическии, экологически, экономика, экономист, энергозатраты, эко, топливныи, экономия, топливо, газоснабжение, энергоресурсы, утилизация, энергообъект, экологиче, газа, энергокомпания, энергоснабжение, уменьшать, уменьшение, утилизировать, биотопливо, сокращение, энергетика, энергосбытовыи, утилизироваться, энергоемкии, экономическии, бензин, энергоатом, энерго, уменьшаться, природоохранныи, газ, экономить, энергоустановка, газообразныи, росэнергоатом, экология, энергия, минимизация, экономически, уменьшить, энергоноситель, минимизировать, газопереработка, экономныи"
Климат,101,"климатическии, климат, риска, риск, рисковои, опасность, факторинг, пасность, атмосфера, атмосферныи, кризисныи, опасение, фактор, природоохранныи, аварииность, катастрофа, эколог, глобальныи, география, географическии, ископаемое, обесценение, характеризовать, кризис, обстановка, безопасность, экологическии, экосистема, изменение, сценарии, турист, природа, вероятность, экология, мероприятие, минприрода, политик, обесценить, экопросвещение, теплогенерация, потепление, туристическии, геотермальныи, страхование, опасныи, адресность, теплов, сцена, агрохимическии, происшествие"
Отходы,106,"земельныи, земля, почва, почвенныи, геология, грунт, геолог, участок, геотермальныи, территория, геологоразведка, землянои, эколог, землетрясение, грунтовыи, захоронение, уничтожение, рекультивация, загрязнение, территориальныи, экология, подземныи, месторождение, разрушение, ископаемое, земнои, загрязнить, территориально, загрязнять, наземныи, реконструкция, геополитическии, нефтезагрязнить, экологичныи, реставрация, утилизироваться, география, поселение, географическии, озеленение, экологическии, отход, удобрение, заповедник, строиплощадка, утилизировать, восстанавливать, торф, переселение, загрязнитель"
E,111,"экологическии, экологически, экология, экологичность, эколог, экологичныи, природоохранныи, экосистема, экологиче, экопросвещение, онкологическии, биотопливо, биотехнология, гидрологическии, геологоразведка, биоресурсы, геологическии, эко, биоразнообразие, органическии, нологическии, геология, биомасса, окружение, биологическии, обстановка, геолог, агрохимическии, биосферныи, экономныи, природа, онкология, социологическии, климатическии, метрологическии, геофизическии, природныи, организационныи, антропогенныи, энергетическии, идеология, нефтехимическии, нефтегазодобыча, заповедник, газификация, нефтезагрязнить, месторождение, биология, геополитическии, нефтепродукт"
