topic_name,topic_id,words
Отходы,113,"упаковка, упаковочныи, эколог, утилизировать, утилизироваться, пакет, глобализация, экологичныи, экопросвещение, переселение, утилизация, экологическии, переизбрать, отход, мусор, экологически, экосистема, экологичность, преобразование, переработка, заполнять, отстранение, рекуперация, уменьшать, эвакуация, складирование, уменьшаться, пакша, глобальныи, реставрация, возрождение, инвентаризация, ганизация, заполнение, экология, пакетныи, поставляться, экономика, перевыполнить, эко, реорганизация, энергозатраты, стратегическии, биотопливо, выбрасывать, пластик, поселение, дисконтирование, стратегически, перерабатывать"
Энергия,119,"электростанция, электрификация, присоединение, новгородэнерго, тариф, электричество, энергосбытовыи, электросетевои, энергосбыт, энергокомплекс, энергия, энергозатраты, электросвязь, электроэнергия, энерго, энергоснабжение, энергообъект, тарифныи, власть, энергопринимать, энергоатом, мощность, соединять, электротехника, энергохолдинг, энергоаудит, техническии, энергоустановка, энергоемкии, энергоресурсы, объединение, федерация, энергетика, энергосервис, договор, электропрофсоюз, энергосервисныи, контрактация, технологичность, ленэнерго, псковэнерго, эквивалент, технически, технологически, требование, алтаиэнерго, мегаватт, договоренность, увеличение, увеличиться"
E,122,"эколог, экологическии, экологичныи, лесничество, лес, лесопользование, экологически, лесозаготовка, экологичность, природоохранныи, экопросвещение, заповедник, леснои, экология, экосистема, эко, древесныи, озеленение, нефть, природа, растительность, биотопливо, природныи, территория, древесина, экологиче, лесосибирскии, экономист, месторождение, добровольчество, добровольческии, дерево, деревообработка, добровольно, климатическии, добровольныи, экономика, земельныи, биоресурсы, квалификация, инстанция, климат, поселение, экономия, биоразнообразие, затрата, геолог, ресурсныи, заповедныи, экономныи"
Климат,129,"воркутауголь, уголь, угольныи, шахта, декарбонизация, шахтныи, шахтер, углеродныи, экономика, углерод, бурятэнерго, угол, экономическии, экономически, казахстан, минэнерго, угледобывающии, кризисныи, углекислыи, географическии, география, карелэнерго, территория, добыча, коалиция, ископаемое, башкортостан, таманьнефтегаз, венгрия, добычныи, атомпроект, кризис, экспорт, граница, доля, ресурсныи, математика, сотрудничество, разграничить, ресурс, регион, энерго, углеводородныи, ограничить, трудоемкость, капитал, энергозатраты, задание, запад, инстанция"
Энергия,145,"энергосбытовыи, энергозатраты, энергосбыт, энергоаудит, электроэнергия, энергоемкии, энергоснабжение, энергоресурсы, энергокомпания, энерго, электросетевои, электростанция, электричество, энергия, энергопринимать, энергоноситель, энергообъект, энергоустановка, электрификация, энергоемкость, энергохолдинг, сеть, энергокомплекс, мосэнергосбыт, новгородэнерго, потеря, энергобаланс, энергосервисныи, власть, энергетика, теплоэнергия, потерять, энергоатом, энергосервис, сетевои, энергосистема, электросвязь, мощность, энергетическии, потерянныи, минэнерго, сетка, терять, ленэнерго, теплоэнергетика, мосэнерго, тарифныи, роспотребнадзор, ветроэнергетика, электрическии"
Энергия,167,"электроэнергия, энергосбытовыи, электричество, электростанция, энергосбыт, энергообъект, энергозатраты, энергоаудит, электрификация, энергоресурсы, роспотребнадзор, энергоустановка, энергоемкии, потребление, энерго, энергоноситель, энергоснабжение, электрическии, энергокомплекс, потребитель, электросеть, энергохолдинг, злоупотребление, энергоемкость, энергия, энергетика, энергокомпания, энергопринимать, власть, электротехника, энергоатом, электросетевои, энергосервисныи, новгородэнерго, мосэнергосбыт, потребительскии, энергосервис, электро, энергетическии, росэнергоатом, электролизныи, электролиз, энергосистема, теплоэнергия, энергобаланс, энергоблок, энерджи, ветроэнергетика, ленэнерго, электросвязь"
Энергия,214,"энергохолдинг, энергосбытовыи, энергообъект, электроэнергия, энергокомплекс, энергосбыт, теплоэнергия, изменение, энергозатраты, энергия, энергоаудит, теплообменныи, энергоснабжение, энергоемкии, теплоэнергетика, энергоресурсы, энергоустановка, энергетика, энергопринимать, теплообменник, энерго, энергосервисныи, энергетическии, энергоатом, энергокомпания, электростанция, росэнергоатом, обменяться, обмен, мосэнергосбыт, энергобаланс, дивиденд, энергосервис, магаданэнерго, новгородэнерго, энергоноситель, обмениваться, отопление, энергоемкость, псковэнерго, ленэнерго, тыс, электричество, преобразование, измениться, власть, тепловыделяющии, теплогенерация, бурятэнерго, дивидендныи"
Энергия,259,"топливо, топливныи, годовои, ежегодно, годовщина, биотопливо, росэнергоатом, бензиновыи, ежегодныи, атомэнергопром, авиатопливо, бензин, года, летныи, году, энергоатом, росатом, газпромнефть, год, газотурбинныи, бензол, нефтегазодобыча, газовыи, газомоторныи, газообразныи, нефтегазовыи, атомныи, летнии, газоочистныи, севергазпром, газпром, газоснабжение, долголетие, атомфлот, десятилетнии, газа, многолетнии, газ, роснефть, энергозатраты, полугодие, долгосрочныи, вниигаз, ископаемое, летательныи, юбилеи, энергоемкии, концессионныи, эмиссия, летальныи"
Биоразнообразие ,286,"заповедник, территориальныи, территория, ограничение, территориально, предел, ограниченныи, ограничительныи, заповедныи, ограничить, областнои, ограничивать, ограничиваться, граница, неограниченныи, пограничныи, земельныи, макрорегион, разграничить, федеральныи, локальныи, разграничение, ставропольскии, республика, локация, ставрополь, регион, численность, региональныи, национальныи, дискриминация, местность, население, округа, дивидендныи, площадь, поселение, парковыи, дивиденд, парка, парк, зона, водохранилище, земля, местообитание, землянои, минприрода, поселок, депозитарии, нижневартовск"
Биоразнообразие ,311,"природоохранныи, природныи, экологическии, экологичность, природа, экологически, экология, экологичныи, эколог, естественныи, экологиче, минприрода, экосистема, заповедник, геологическии, биотопливо, биоресурсы, гидрологическии, биотехнология, биоразнообразие, агрохимическии, онкологическии, антропогенныи, биологическии, натуральныи, биосферныи, геофизическии, органическии, водоохранныи, характерныи, заповедныи, нологическии, геологоразведка, экопросвещение, биомасса, климатическии, биология, ископаемое, газохимическии, охранныи, геология, месторождение, эко, сохранность, организационныи, атмосферныи, обстановка, экономныи, онкология, нефтехимическии"